{
  "$schema": "https://json-schema.org/draft/2020-12/schema",
  "$id": "https://github.com/cavi-ai/mlx-agent/schemas/intake.schema.json",
  "title": "mlx-agent intake resolve data payload",
  "type": "object",
  "additionalProperties": false,
  "required": ["schema", "source", "verdict", "reasons", "backend", "backend_installed", "model_type",
               "components", "task", "custom_code", "gated", "library_name", "pipeline_tag",
               "transformers_version", "bytes", "download_bytes", "estimated_output_bytes", "q_bits", "recipe", "files", "mlx_conversions", "warnings"],
  "properties": {
    "schema": {"const": "intake/1"},
    "source": {"$ref": "#/$defs/source"},
    "verdict": {"enum": ["unknown", "blocked", "already_mlx", "gguf", "convertible", "convertible_after_install", "unsupported"]},
    "reasons": {"type": "array", "items": {"enum": ["gated", "not_found_or_private", "hub_unreachable", "no_config", "arch_not_in_registry", "custom_code", "subfolder_not_found"]}},
    "backend": {"type": ["string", "null"]},
    "backend_installed": {"type": "boolean"},
    "model_type": {"type": ["string", "null"]},
    "components": {"type": "array", "items": {"$ref": "#/$defs/component"}},
    "task": {"anyOf": [{"type": "null"}, {"$ref": "#/$defs/task"}]},
    "custom_code": {"type": "boolean"},
    "gated": {"type": "boolean"},
    "library_name": {"type": ["string", "null"]},
    "pipeline_tag": {"type": ["string", "null"]},
    "transformers_version": {"type": ["string", "null"]},
    "bytes": {"type": "integer", "minimum": 0},
    "download_bytes": {"type": "integer", "minimum": 0},
    "cached": {"type": "boolean"},
    "q_bits": {"type": "array", "minItems": 1, "uniqueItems": true, "items": {"enum": [4, 8]}},
    "recipe": {"oneOf": [{"type": "null"}, {
      "type": "object", "additionalProperties": false, "required": ["base", "base_revision", "lora", "lora_scale"],
      "properties": {
        "base": {"type": "string"}, "base_revision": {"type": "string", "pattern": "^[0-9a-f]{40}$"},
        "lora": {"type": "string"}, "lora_scale": {"type": "number"}
      }
    }]},
    "estimated_output_bytes": {"oneOf": [{"type": "null"}, {"type": "object", "properties": {"4": {"type": "integer", "minimum": 0}, "8": {"type": "integer", "minimum": 0}}, "required": ["4", "8"], "additionalProperties": false}]},
    "files": {
      "type": "object", "additionalProperties": false,
      "required": ["safetensors", "gguf", "python"],
      "properties": {
        "safetensors": {"type": "integer", "minimum": 0},
        "gguf": {"type": "array", "items": {
          "type": "object", "additionalProperties": false, "required": ["name", "bytes"],
          "properties": {"name": {"type": "string"}, "bytes": {"type": "integer", "minimum": 0}}
        }},
        "python": {"type": "array", "items": {"type": "string"}}
      }
    },
    "mlx_conversions": {"type": "array", "items": {
      "type": "object", "additionalProperties": false, "required": ["repo", "downloads", "library_name"],
      "properties": {
        "repo": {"type": "string", "minLength": 1},
        "downloads": {"type": "integer", "minimum": 0},
        "library_name": {"type": ["string", "null"]}
      }
    }},
    "warnings": {"type": "array", "items": {"type": "string"}}
  },
  "$defs": {
    "source": {
      "type": "object", "additionalProperties": false,
      "required": ["input", "repo", "revision", "file", "subfolder", "url"],
      "properties": {
        "input": {"type": "string"},
        "repo": {"type": "string", "pattern": "^[A-Za-z0-9][A-Za-z0-9._-]*/[A-Za-z0-9][A-Za-z0-9._-]*$"},
        "revision": {"type": "string"},
        "file": {"type": ["string", "null"]},
        "subfolder": {"type": ["string", "null"]},
        "url": {"type": "string"}
      }
    },
    "match": {
      "type": "object", "additionalProperties": false,
      "required": ["backend", "category", "match", "module"],
      "properties": {
        "backend": {"type": "string"},
        "category": {"enum": ["text_llm", "vision_language", "speech_to_text", "text_to_speech", "classification", "image_generation", "video_generation", "music_generation"]},
        "match": {"enum": ["exact", "remap", "stripped", "squashed"]},
        "module": {"type": "string"}
      }
    },
    "component": {
      "type": "object", "additionalProperties": false,
      "required": ["role", "config_key", "model_type", "matches"],
      "properties": {
        "role": {"type": "string"},
        "config_key": {"type": ["string", "null"]},
        "model_type": {"type": "string"},
        "matches": {"type": "array", "items": {"$ref": "#/$defs/match"}}
      }
    },
    "task": {
      "type": "object", "additionalProperties": false,
      "required": ["type", "use_cases", "source", "confidence"],
      "properties": {
        "type": {"enum": ["text_llm", "vision_language", "speech_to_text", "text_to_speech", "embedding", "classification", "image_generation", "video_generation", "music_generation", "speculative_draft", "other"]},
        "use_cases": {"type": "array", "items": {"type": "string"}},
        "source": {"enum": ["pipeline_tag", "registry", "gguf_architecture", "config", "name", "default"]},
        "confidence": {"enum": ["confirmed", "likely"]}
      }
    }
  }
}
