{
  "backend": "mlx-audio",
  "backend_installed": false,
  "bytes": 8190357485,
  "components": [
    {
      "config_key": null,
      "matches": [
        {
          "backend": "mlx-audio",
          "category": "speech_to_text",
          "match": "exact",
          "module": "mlx_audio.stt.models.audio8_asr_infinite"
        }
      ],
      "model_type": "audio8_asr_infinite",
      "role": "model"
    },
    {
      "config_key": "audio_config",
      "matches": [
        {
          "backend": "mlx-audio",
          "category": "speech_to_text",
          "match": "stripped",
          "module": "mlx_audio.stt.models.voxtral_realtime"
        }
      ],
      "model_type": "voxtral_realtime_encoder",
      "role": "audio"
    },
    {
      "config_key": "text_config",
      "matches": [
        {
          "backend": "mlx-lm",
          "category": "text_llm",
          "match": "exact",
          "module": "mlx_lm.models.qwen2"
        },
        {
          "backend": "mlx-vlm",
          "category": "vision_language",
          "match": "exact",
          "module": "mlx_vlm.models.qwen2"
        }
      ],
      "model_type": "qwen2",
      "role": "text"
    }
  ],
  "custom_code": true,
  "download_bytes": 8184270077,
  "estimated_output_bytes": {
    "4": 3748321085,
    "8": 5291169597
  },
  "files": {
    "gguf": [],
    "python": [
      "configuration_audio8_asr_infinite.py",
      "modeling_audio8_asr_infinite.py"
    ],
    "safetensors": 2
  },
  "gated": false,
  "library_name": "transformers",
  "model_type": "audio8_asr_infinite",
  "pipeline_tag": "automatic-speech-recognition",
  "q_bits": [
    4,
    8
  ],
  "reasons": [],
  "recipe": null,
  "schema": "intake/1",
  "source": {
    "file": null,
    "input": "https://huggingface.co/Edge0/Audio8-ASR-Infinite",
    "repo": "Edge0/Audio8-ASR-Infinite",
    "revision": "main",
    "subfolder": null,
    "url": "https://huggingface.co/Edge0/Audio8-ASR-Infinite"
  },
  "task": {
    "confidence": "confirmed",
    "source": "pipeline_tag",
    "type": "speech_to_text",
    "use_cases": [
      "realtime_transcription",
      "transcription"
    ]
  },
  "mlx_conversions": [],
  "transformers_version": "5.13.0",
  "verdict": "convertible_after_install",
  "warnings": []
}
